id,name,name_jp,name_ko,effect_entry,effect_entry_ko,effect_detail,introduced_generation_id
53,Pickup,ものひろい,픽업,"The Pokémon may pick up an item another Pokémon used during a battle. It may pick up items outside of battle, too.",상대가 사용한 도구를 주워 올 때가 있다. 모험 중에도 주워 온다.,"At the end of each turn, if another Pokémon consumed or Flung a held item that turn, this Pokémon picks up the item if it is not already holding one.  After each battle, this Pokémon has a 10% chance of picking up an item if it is not already holding one.  The air balloon and eject button cannot be picked up.  The items that may be found vary by game, and, since Pokémon Emerald, by the Pokémon's level.  This ability is checked after the battle ends, at which point any temporary ability changes have worn off.",3
54,Truant,なまけ,게으름,"Each time the Pokémon uses a move, it spends the next turn loafing around.",기술을 사용하면 다음 턴은 쉰다.,"Every second turn on which this Pokémon should attempt to use a move, it will instead do nothing (""loaf around"").  Loafing around interrupts moves that take multiple turns the same way paralysis, flinching, etc do.  Most such moves, for example bide or rollout, are simply cut off upon loafing around.  Attacks with a recharge turn, such as hyper beam, do not have to recharge; attacks with a preparation turn, such as fly, do not end up being used.  Moves that are forced over multiple turns and keep going through failure, such as outrage, uproar, or any move forced by encore, keep going as usual.  If this Pokémon is confused, its confusion is not checked when loafing around; the Pokémon cannot hurt itself, and its confusion does not end or come closer to ending.  If this Pokémon attempts to move but fails, e.g. because of paralysis or gravity, it still counts as having moved and will loaf around the next turn.  If it does not attempt to move, e.g. because it is asleep or frozen, whatever it would have done will be postponed until its next attempt; that is, it will either loaf around or move as usual, depending on what it last did.  This ability cannot be changed with worry seed, but it can be disabled with gastro acid, changed with role play, or traded away with skill swap.",3
55,Hustle,はりきり,의욕,Boosts the Pokémon's Attack stat but lowers its accuracy.,자신의 공격이 높아지지만 명중률이 떨어진다.,"This Pokémon's physical moves do 1.5× as much regular damage, but have 0.8× their usual accuracy.  Special moves are unaffected.  Moves that do set damage, such as seismic toss, have their accuracy affected, but not their damage.  Overworld: If the lead Pokémon has this ability, higher-levelled Pokémon have their encounter rate increased.",3
56,Cute Charm,メロメロボディ,헤롱헤롱바디,The Pokémon may infatuate attackers that make direct contact with it.,자신에게 접촉한 상대를 헤롱헤롱하게 만들 때가 있다.,"Whenever a move makes contact with this Pokémon, the move's user has a 30% chance of being infatuated.  Overworld: If the first Pokémon in the party has this ability, any wild Pokémon whose species can be either gender has a 2/3 chance of being set to the opposite gender, and a 1/3 chance of having a random gender as usual.",3
57,Plus,プラス,플러스,Boosts the Sp. Atk stat of the Pokémon if an ally with the Plus or Minus Ability is also in battle.,플러스나 마이너스의 특성을 가진 포켓몬이 동료에 있으면 자신의 특수공격이 올라간다.,"This Pokémon has 1.5× its Special Attack if any friendly Pokémon has plus or minus.  This bonus does not count as a stat modifier.  If either ability is disabled by gastro acid, both lose their effect.",3
58,Minus,マイナス,마이너스,Boosts the Sp. Atk stat of the Pokémon if an ally with the Plus or Minus Ability is also in battle.,플러스나 마이너스의 특성을 가진 포켓몬이 동료에 있으면 자신의 특수공격이 올라간다.,"This Pokémon has 1.5× its Special Attack if any friendly Pokémon has plus or minus.  This bonus does not count as a stat modifier.  If either ability is disabled by gastro acid, both lose their effect.",3
59,Forecast,てんきや,기분파,"The Pokémon transforms with the weather to change its type to Water, Fire, or Ice.","날씨의 영향을 받아 물타입, 불꽃타입, 얼음타입 중 하나로 변화한다.","During rain, strong sunlight, or hail, this Pokémon's type changes to water, fire, or ice, respectively, and its form changes to match.  This ability has no effect for any Pokémon other than castform.  If the weather ends or becomes anything that does not trigger this ability, or a Pokémon with air lock or cloud nine enters battle, this Pokémon's type and form revert to their default.  If this ability is lost or disabled, this Pokémon cannot change its current type and form until it regains its ability.",3
60,Sticky Hold,ねんちゃく,점착,The Pokémon's held items cling to its sticky body and cannot be removed by other Pokémon.,점성이 높은 몸에 도구가 달라붙어 있어 상대에게 도구를 뺏기지 않는다.,"This Pokémon's hold item cannot be removed by other Pokémon.  Damaging moves that would remove this Pokémon's item can still inflict damage against this Pokémon, e.g. knock off or pluck.  This Pokémon can still use moves that involve the loss of its own item, e.g. fling or trick.  Overworld: If the lead Pokémon has this ability, the encounter rate while fishing is increased.",3
61,Shed Skin,だっぴ,탈피,The Pokémon may cure its own status conditions by shedding its skin.,몸의 껍질을 벗어 던져 상태 이상을 회복할 때가 있다.,"After each turn, this Pokémon has a 33% of being cured of any major status ailment.",3
62,Guts,こんじょう,근성,It's so gutsy that having a status condition boosts the Pokémon's Attack stat.,상태 이상이 되면 근성을 보여서 공격이 올라간다.,"Whenever this Pokémon is asleep, burned, paralyzed, or poisoned, it has 1.5× its Attack.  This Pokémon is not affected by the usual Attack cut from a burn.  This bonus does not count as a stat modifier.",3
63,Marvel Scale,ふしぎなうろこ,이상한비늘,The Pokémon's marvelous scales boost its Defense stat if it has a status condition.,상태 이상이 되면 이상한 비늘이 반응해서 방어가 올라간다.,"Whenever this Pokémon has a major status ailment, it has 1.5× its Defense.  This bonus does not count as a stat modifier.",3
64,Liquid Ooze,ヘドロえき,해감액,The strong stench of the Pokémon's oozed liquid damages attackers that use HP-draining moves.,해감액을 흡수한 상대는 강렬한 악취로 데미지를 받아 HP가 줄어든다.,"Whenever a Pokémon would heal after hitting this Pokémon with a leeching move like absorb, it instead loses as many HP as it would usually gain.  dream eater is unaffected.",3
65,Overgrow,しんりょく,심록,Powers up Grass-type moves when the Pokémon's HP is low.,HP가 줄었을 때 풀타입 기술의 위력이 올라간다.,"When this Pokémon has 1/3 or less of its HP remaining, its grass-type moves inflict 1.5× as much regular damage.",3
66,Blaze,もうか,맹화,Powers up Fire-type moves when the Pokémon's HP is low.,HP가 줄었을 때 불꽃타입 기술의 위력이 올라간다.,"When this Pokémon has 1/3 or less of its HP remaining, its fire-type moves inflict 1.5× as much regular damage.",3
67,Torrent,げきりゅう,급류,Powers up Water-type moves when the Pokémon's HP is low.,HP가 줄었을 때 물타입 기술의 위력이 올라간다.,"When this Pokémon has 1/3 or less of its HP remaining, its water-type moves inflict 1.5× as much regular damage.",3
68,Swarm,むしのしらせ,벌레의알림,Powers up Bug-type moves when the Pokémon's HP is low.,HP가 줄었을 때 벌레타입 기술의 위력이 올라간다.,"When this Pokémon has 1/3 or less of its HP remaining, its bug-type moves inflict 1.5× as much regular damage.  Overworld: If the lead Pokémon has this ability, the wild encounter rate is increased.",3
69,Rock Head,いしあたま,돌머리,Protects the Pokémon from recoil damage.,반동을 받는 기술을 사용해도 HP가 줄지 않는다.,This Pokémon does not receive recoil damage from its recoil moves.  struggle's recoil is unaffected.  This ability does not prevent crash damage from missing with jump kick or high jump kick.,3
70,Drought,ひでり,가뭄,Turns the sunlight harsh when the Pokémon enters a battle.,등장했을 때 날씨를 맑음으로 만든다.,"The weather changes to strong sunlight for 5 turns when this Pokémon enters battle. If multiple Pokémon with this ability, drizzle, sand stream, or snow warning are sent out at the same time, the abilities will activate in order of Speed, respecting trick room.  Each ability's weather will cancel the previous weather, and only the weather summoned by the slowest of the Pokémon will stay. If the weather is extremely harsh sunlight, heavy rain, or mysterious air current, this ability will not be activated.",3
71,Arena Trap,ありじごく,개미지옥,Prevents opposing Pokémon from fleeing from battle.,배틀에서 상대를 도망칠 수 없게 한다.,"While this Pokémon is in battle, opposing Pokémon cannot flee or switch out.  flying-type Pokémon and Pokémon in the air, e.g. due to levitate or magnet rise, are unaffected.  Pokémon with run away can still flee.  Pokémon can still switch out with the use of a move or item.  Overworld: If the lead Pokémon has this ability, the wild encounter rate is doubled.",3
72,Vital Spirit,やるき,의기양양,"The Pokémon is full of vitality, and that prevents it from falling asleep.",의기양양해져서 잠듦 상태가 되지 않는다.,"This Pokémon cannot be asleep.  This causes rest to fail altogether.  If a Pokémon is asleep and acquires this ability, it will immediately wake up; this includes when regaining a lost ability upon leaving battle.  This ability functions identically to insomnia in battle.  Overworld: If the lead Pokémon has this ability, higher-levelled Pokémon have their encounter rate increased.",3
73,White Smoke,しろいけむり,하얀연기,"The Pokémon is protected by its white smoke, which prevents other Pokémon from lowering its stats.",하얀 연기의 보호를 받아 상대가 능력을 떨어뜨리지 못하게 한다.,"This Pokémon cannot have its stats lowered by other Pokémon.  This ability does not prevent any stat losses other than stat modifiers, such as the Speed cut from paralysis; nor self-inflicted stat drops, such as the Special Attack drop from overheat; nor opponent-triggered stat boosts, such as the Attack boost from swagger.  This Pokémon can still be passed negative stat modifiers through guard swap, heart swap, or power swap.  This ability functions identically to clear body in battle.  Overworld: If the lead Pokémon has this ability, the wild encounter rate is halved.",3
74,Pure Power,ヨガパワー,순수한힘,"Using its pure power, the Pokémon doubles its Attack stat.",요가의 힘으로 물리공격의 위력이 2배가 된다.,This Pokémon's Attack is doubled in battle.  This bonus does not count as a stat modifier.  This ability functions identically to huge power.,3
75,Shell Armor,シェルアーマー,조가비갑옷,A hard shell protects the Pokémon from critical hits.,단단한 껍질의 보호를 받아 상대의 공격이 급소에 맞지 않는다.,Moves cannot score critical hits against this Pokémon.  This ability functions identically to battle armor.,3
76,Air Lock,エアロック,에어록,Eliminates the effects of weather.,모든 날씨의 영향이 없어진다.,"While this Pokémon is in battle, weather can still be in play, but will not have any of its effects.  This ability functions identically to cloud nine.",3
77,Tangled Feet,ちどりあし,갈지자걸음,Boosts the Pokémon's evasiveness if it is confused.,혼란 상태일 때는 회피율이 올라간다.,"When this Pokémon is confused, it has twice its evasion.",4
78,Motor Drive,でんきエンジン,전기엔진,"The Pokémon takes no damage when hit by Electric-type moves. Instead, its Speed stat is boosted.",전기타입의 기술로 공격받으면 데미지를 받지 않고 스피드가 올라간다.,"Whenever an electric-type move hits this Pokémon, its Speed rises one stage, negating any other effect on it.  This ability will not take effect if this Pokémon is immune to Electric moves.  Electric moves will ignore this Pokémon's substitute.  This effect includes non-damaging moves, i.e. thunder wave.",4
79,Rivalry,とうそうしん,투쟁심,"The Pokémon's competitive spirit makes it deal more damage to Pokémon of the same gender, but less damage to Pokémon of the opposite gender.",성별이 같으면 투쟁심을 불태워 강해진다. 성별이 다르면 약해진다.,"This Pokémon inflicts 1.25× as much regular damage against Pokémon of the same gender and 0.75× as much regular damage against Pokémon of the opposite gender.  If either Pokémon is genderless, damage is unaffected.",4
80,Steadfast,ふくつのこころ,불굴의마음,The Pokémon's determination boosts its Speed stat every time it flinches.,풀죽을 때마다 불굴의 마음을 불태워 스피드가 올라간다.,"Whenever this Pokémon flinches, its Speed rises one stage.",4
81,Snow Cloak,ゆきがくれ,눈숨기,Boosts the Pokémon's evasiveness in snow.,날씨가 눈일 때 회피율이 올라간다.,"During hail/snowstorm, this Pokémon has 1.25× its evasion, and it does not take hail damage regardless of type.  The evasion bonus does not count as a stat modifier.  Overworld: If the lead Pokémon has this ability, the wild encounter rate is halved in snow.",4
82,Gluttony,くいしんぼう,먹보,"If the Pokémon is holding a Berry to be eaten when its HP is low, it will instead eat the Berry when its HP drops to half or less.",HP가 줄어들면 먹을 나무열매를 HP가 절반일 때 먹어 버린다.,"This Pokémon eats any held Berry triggered by low HP when it falls below 50% of its HP, regardless of the Berry's usual threshold.",4
83,Anger Point,いかりのつぼ,분노의경혈,"The Pokémon is angered when it takes a critical hit, and that maxes its Attack stat.",급소에 공격이 맞으면 크게 분노해 공격력이 최대가 된다.,"Whenever this Pokémon receives a critical hit, its Attack rises to the maximum of 6 stages.  This ability will still take effect if the critical hit is received by a substitute.",4
84,Unburden,かるわざ,곡예,Boosts the Speed stat if the Pokémon's held item is used or lost.,지니던 도구가 없어지면 스피드가 올라간다.,"When this Pokémon uses or loses its held item, its Speed is doubled.  If it gains another item or leaves battle, this bonus is lost.  This includes when the Pokémon drops its item because of knock off.  This bonus does not count as a stat modifier.  There is no notification when this ability takes effect.",4
85,Heatproof,たいねつ,내열,The Pokémon's heatproof body halves the damage taken from Fire-type moves.,내열인 몸으로 인해 불꽃타입 공격의 데미지를 반감한다.,This Pokémon takes half as much damage from fire-type moves and burns.,4
86,Simple,たんじゅん,단순,Doubles the effects of the Pokémon's stat changes.,능력 변화가 평소의 2배가 된다.,"Each stage of this Pokémon's stat modifiers acts as two stages.  These doubled stages are still limited to a minimum of -6 and a maximum of 6.  This Pokémon can still accumulate less than -3 or more than 3 stages of stat modifiers, even though the extra ones have no effect after doubling.",4
87,Dry Skin,かんそうはだ,건조피부,"Restores the Pokémon's HP in rain or when it is hit by Water-type moves. Reduces HP in harsh sunlight, and increases the damage received from Fire-type moves.",비가 오는 날씨나 물타입의 기술로 공격받으면 HP가 회복되고 맑을 때나 불꽃타입의 기술로 공격받으면 줄어든다.,"This Pokémon takes 1/8 of its maximum HP in damage after each turn during strong sunlight, but it heals for 1/8 of its HP each turn during rain.  This Pokémon takes 1.25× as much damage from fire-type moves, but whenever a water move hits it, it heals for 1/4 its maximum HP instead.",4
88,Download,ダウンロード,다운로드,The Pokémon compares an opposing Pokémon's Defense and Sp. Def stats before raising its own Attack or Sp. Atk stat — whichever will be more effective.,상대의 방어와 특수방어를 비교해서 낮은 쪽 능력에 맞춰서 자신의 공격이나 특수공격을 올린다.,"When this Pokémon enters battle, its Attack or Special Attack, whichever corresponds to its opponents' weaker total defensive stat, rises one stage.  In the event of a tie, Special Attack is raised.  This ability also takes effect when acquired during a battle.",4
89,Iron Fist,てつのこぶし,철주먹,Powers up punching moves.,펀치를 사용하는 기술의 위력이 올라간다.,"Moves flagged as being punch-based have 1.2× their base power for this Pokémon.  sucker punch is not flagged as punch-based; its original, Japanese name only means ""surprise attack"".",4
90,Poison Heal,ポイズンヒール,포이즌힐,"If poisoned, the Pokémon has its HP restored instead of taking damage.",독 상태가 되면 HP가 줄지 않고 증가한다.,"If this Pokémon is poisoned, it will heal for 1/8 of its maximum HP after each turn rather than taking damage.  This includes bad poison.",4
91,Adaptability,てきおうりょく,적응력,Powers up moves of the same type as the Pokémon.,자신과 같은 타입인 기술의 위력이 올라간다.,"This Pokémon inflicts twice as much damage with moves whose types match its own, rather than the usual same-type attack bonus of 1.5×.",4
92,Skill Link,スキルリンク,스킬링크,Maximizes the number of times multistrike moves hit.,연속 기술을 사용하면 항상 최고 횟수로 사용할 수 있다.,"This Pokémon always hits five times with two-to-five-hit moves, such as icicle spear.  It also bypasses the accuracy checks on triple kick's second and third hits.",4
93,Hydration,うるおいボディ,촉촉바디,Cures the Pokémon's status conditions in rain.,비가 오는 날씨일 때 상태 이상이 회복된다.,This Pokémon is cured of any major status ailment after each turn during rain.,4
94,Solar Power,サンパワー,선파워,"In harsh sunlight, the Pokémon's Sp. Atk stat is boosted, but its HP decreases every turn.",날씨가 맑으면 특수공격이 올라가지만 매 턴 HP가 줄어든다.,"During strong sunlight, this Pokémon has 1.5× its Special Attack but takes 1/8 of its maximum HP in damage after each turn.",4
95,Quick Feet,はやあし,속보,Boosts the Speed stat if the Pokémon has a status condition.,상태 이상이 되면 스피드가 올라간다.,"Whenever this Pokémon has a major status ailment, it has 1.5× its Speed.  This Pokémon is not affected by the usual Speed cut from paralysis.  Overworld: If the lead Pokémon has this ability, the wild encounter rate is halved.",4
96,Normalize,ノーマルスキン,노말스킨,All the Pokémon's moves become Normal type. The power of those moves is boosted a little.,사용하는 기술의 타입이 모두 노말타입이 된다. 위력이 조금 올라간다.,"This Pokémon's moves all act as if they were normal-type.  Moves that inflict typeless damage do so as usual.  Moves of variable type, such as hidden power, are affected.  They otherwise work as usual, however; weather ball, for example, is always forced to be Normal, but it still has doubled power and looks different during weather.  As thunder wave is prevented by immunities, unlike most non-damaging moves, it does not affect ghost-type Pokémon under the effect of this ability.",4
97,Sniper,スナイパー,스나이퍼,"If the Pokémon's attack lands a critical hit, the attack is powered up even further.",공격을 급소에 맞혔을 때 위력이 더욱 올라간다.,"This Pokémon inflicts triple damage with critical hits, rather than the usual double damage.",4
98,Magic Guard,マジックガード,매직가드,The Pokémon only takes damage from attacks.,공격 이외에는 데미지를 받지 않는다.,"This Pokémon is immune to damage not directly caused by a move.  For example, this Pokémon takes no damage from from weather, recoil, status ailments, or spikes, but it still suffers from the Attack cut when burned, and a life orb will still power up this Pokémon's moves without damaging it.  Anything that directly depends on such damage will also not happen; for example, leech seed will neither hurt this Pokémon nor heal the opponent, and Pokémon with a jaboca berry or rowap berry will not consume the berry when hit by this Pokémon.  The following are unaffected: struggle, pain split (whether used by or against this Pokémon), belly drum, substitute, curse, moves that knock the user out, and damage from confusion.  This Pokémon will neither lose nor regain HP if it drains HP from a Pokémon with liquid ooze.  If this Pokémon is badly poisoned, the poison counter is still increased each turn; if the Pokémon loses this ability, it will begin taking as much damage as it would be if it had been taking increasing damage each turn.",4
99,No Guard,ノーガード,노가드,The Pokémon employs no-guard tactics to ensure incoming and outgoing attacks always land.,노가드전법에 따라 서로가 사용하는 기술이 반드시 맞게 된다.,"Moves used by or against this Pokémon never miss.  One-hit KO moves are unaffected.  Moves affected by this ability can hit Pokémon during the preparation turn of moves like dig or fly.  Overworld: If the lead Pokémon has this ability, the wild encounter rate is doubled.",4
100,Stall,あとだし,시간벌기,The Pokémon is always the last to use its moves.,기술을 사용하는 순서가 반드시 마지막이 된다.,"This Pokémon moves last within its priority bracket.  Multiple Pokémon with this ability move in order of Speed amongst themselves.  The full incense and lagging tail take precedence over this ability; that is, Pokémon with these items move after Pokémon with this ability.  Pokémon with both this ability and one of these items are delayed as much as if they had only the item.  This ability works as usual during trick room: Pokémon with this ability will move in reverse order of Speed after Pokémon without it.",4
101,Technician,テクニシャン,테크니션,Powers up weak moves so the Pokémon can deal more damage with them.,위력이 약한 기술의 위력을 올려서 공격할 수 있다.,"This Pokémon's moves have 1.5× their power if their base power is 60 or less.  This includes moves of variable power, such as hidden power and magnitude, when their power is 60 or less.  helping hand's power boost is taken into account for any move, as is defense curl's power boost for rollout.",4
102,Leaf Guard,リーフガード,리프가드,Prevents status conditions in harsh sunlight.,날씨가 맑을 때는 상태 이상이 되지 않는다.,"This Pokémon cannot be given a major status ailment during strong sunlight.  This ability does not heal prior status ailments.  rest will fail altogether with this ability in effect.  yawn will immediately fail if used on this Pokémon during strong sunlight, and an already-used Yawn will fail if the weather turns to strong sunlight in the meantime.",4
103,Klutz,ぶきよう,서투름,The Pokémon can't use any held items.,지니고 있는 도구를 쓸 수 없다.,"In battle, this Pokémon cannot use its held item, nor will the item have any passive effect on the battle, positive or negative.  This Pokémon also cannot use fling.  The Speed cut from the iron ball and the effort items (the macho brace, power weight, power bracer, power belt, power lens, power band, and power anklet) is unaffected.  Items that do not directly affect the battle, such as the exp share, the amulet coin, or the soothe bell, work as usual.  All held items work as usual out of battle.  Other moves that use the held item, such as natural gift and switcheroo, work as usual.",4
