id,name,name_jp,name_ko,effect_entry,effect_entry_ko,effect_detail,introduced_generation_id
1,Stench,あくしゅう,악취,"By releasing a stench when attacking, the Pokémon may cause the target to flinch.",악취를 풍겨서 공격했을 때 상대가 풀죽을 때가 있다.,This Pokémon's damaging moves have a 10% chance to make the target flinch with each hit if they do not already cause flinching as a secondary effect.  This ability does not stack with a held item.  Overworld: The wild encounter rate is halved while this Pokémon is first in the party.,3
2,Drizzle,あめふらし,잔비,The Pokémon makes it rain when it enters a battle.,등장했을 때 날씨를 비로 만든다.,"The weather changes to rain for 5 turns when this Pokémon enters battle. If multiple Pokémon with this ability, drought, sand stream, or snow warning are sent out at the same time, the abilities will activate in order of Speed, respecting trick room.  Each ability's weather will cancel the previous weather, and only the weather summoned by the slowest of the Pokémon will stay. If the weather is extremely harsh sunlight, heavy rain, or mysterious air current, this ability will not be activated.",3
3,Speed Boost,かそく,가속,The Pokémon's Speed stat is boosted every turn.,매 턴 스피드가 올라간다.,This Pokémon's Speed rises one stage after each turn.,3
4,Battle Armor,カブトアーマー,전투무장,Hard armor protects the Pokémon from critical hits.,단단한 껍질에 보호받아 상대의 공격이 급소에 맞지 않는다.,Moves cannot score critical hits against this Pokémon.  This ability functions identically to shell armor.,3
5,Sturdy,がんじょう,옹골참,The Pokémon cannot be knocked out by a single hit as long as its HP is full. One-hit KO moves will also fail to knock it out.,HP가 꽉 찼을 때 기술을 받아도 일격에 쓰러지지 않는다. 일격필살 기술의 효과도 받지 않는다.,"When this Pokémon is at full HP, any hit that would knock it out will instead leave it with 1 HP.  Regardless of its current HP, it is also immune to the one-hit KO moves: fissure, guillotine, horn drill, and sheer cold.  If this Pokémon is holding a focus sash, this ability takes precedence and the item will not be consumed.",3
6,Damp,しめりけ,습기,"The Pokémon dampens its surroundings, preventing all Pokémon from using explosive moves such as Self-Destruct.",주변을 습하게 함으로써 자폭 등 폭발하는 기술을 아무도 못 쓰게 한다.,"While this Pokémon is in battle, self destruct and explosion will fail and aftermath will not take effect.",3
7,Limber,じゅうなん,유연,The Pokémon's limber body prevents it from being paralyzed.,유연한 몸으로 인해 마비 상태가 되지 않는다.,"This Pokémon cannot be paralyzed.  If a Pokémon is paralyzed and acquires this ability, its paralysis is healed; this includes when regaining a lost ability upon leaving battle.",3
8,Sand Veil,すながくれ,모래숨기,Boosts the Pokémon's evasiveness in a sandstorm.,모래바람일 때 회피율이 올라간다.,"During a sandstorm, this Pokémon has 1.25× its evasion, and it does not take sandstorm damage regardless of type.  The evasion bonus does not count as a stat modifier.  Overworld: If the lead Pokémon has this ability, the wild encounter rate is halved in a sandstorm.",3
9,Static,せいでんき,정전기,The Pokémon is charged with static electricity and may paralyze attackers that make direct contact with it.,정전기를 몸에 둘러 자신에게 접촉한 상대를 마비시킬 때가 있다.,"Whenever a move makes contact with this Pokémon, the move's user has a 30% chance of being paralyzed.  Pokémon that are immune to electric-type moves can still be paralyzed by this ability.  Overworld: If the lead Pokémon has this ability, there is a 50% chance that encounters will be with an electric Pokémon, if applicable.",3
10,Volt Absorb,ちくでん,축전,"If hit by an Electric-type move, the Pokémon has its HP restored instead of taking damage.",전기타입의 기술로 공격받으면 데미지를 받지 않고 회복한다.,"Whenever an electric-type move hits this Pokémon, it heals for 1/4 of its maximum HP, negating any other effect on it.  This ability will not take effect if this Pokémon is ground-type and thus immune to Electric moves.  Electric moves will ignore this Pokémon's substitute.  This effect includes non-damaging moves, i.e. thunder wave.",3
11,Water Absorb,ちょすい,저수,"If hit by a Water-type move, the Pokémon has its HP restored instead of taking damage.",물타입의 기술로 공격받으면 데미지를 받지 않고 회복한다.,"Whenever a water-type move hits this Pokémon, it heals for 1/4 of its maximum HP, negating any other effect on it.  Water moves will ignore this Pokémon's substitute.",3
12,Oblivious,どんかん,둔감,"The Pokémon is oblivious, keeping it from being infatuated, falling for taunts, or being affected by Intimidate.",둔감해서 헤롱헤롱이나 도발 상태가 되지 않는다. 위협을 당해도 동요하지 않는다.,"This Pokémon cannot be infatuated and is immune to captivate.  If a Pokémon is infatuated and acquires this ability, its infatuation is cleared.",3
13,Cloud Nine,ノーてんき,날씨부정,Eliminates the effects of weather.,모든 날씨의 영향이 없어진다.,"While this Pokémon is in battle, weather can still be in play, but will not have any of its effects.  This ability functions identically to air lock.",3
14,Compound Eyes,ふくがん,복안,The Pokémon's compound eyes boost its accuracy.,복안을 가지고 있어 기술의 명중률이 올라간다.,"This Pokémon's moves have 1.3× their accuracy.  This ability has no effect on the one-hit KO moves (fissure, guillotine, horn drill, and sheer cold).  Overworld: If the first Pokémon in the party has this ability, the chance of a wild Pokémon holding a particular item is raised from 50%, 5%, or 1% to 60%, 20%, or 5%, respectively.",3
15,Insomnia,ふみん,불면,The Pokémon's insomnia prevents it from falling asleep.,잠들지 못하는 체질이라 잠듦 상태가 되지 않는다.,"This Pokémon cannot be asleep.  This causes rest to fail altogether.  If a Pokémon is asleep and acquires this ability, it will immediately wake up; this includes when regaining a lost ability upon leaving battle.  This ability functions identically to vital spirit in battle.",3
16,Color Change,へんしょく,변색,The Pokémon's type becomes the type of the move used on it.,상대에게 받은 기술의 타입으로 자신의 타입이 변화한다.,"Whenever this Pokémon takes damage from a move, the Pokémon's type changes to match the move.  If the Pokémon has two types, both are overridden.  The Pokémon must directly take damage; for example, moves blocked by a substitute will not trigger this ability, nor will moves that deal damage indirectly, such as spikes.  This ability takes effect on only the last hit of a multiple-hit attack.  In Pokémon Colosseum and XD: Gale of Darkness, this ability does not take effect on Shadow-type moves.",3
17,Immunity,めんえき,면역,The Pokémon's immune system prevents it from being poisoned.,체내에 면역을 가지고 있어 독 상태가 되지 않는다.,"This Pokémon cannot be poisoned.  This includes bad poison.  If a Pokémon is poisoned and acquires this ability, its poison is healed; this includes when regaining a lost ability upon leaving battle.",3
18,Flash Fire,もらいび,타오르는불꽃,"If hit by a Fire-type move, the Pokémon absorbs the flames and uses them to power up its own Fire-type moves.",불꽃타입의 기술로 공격받으면 불꽃을 받아서 자신이 사용하는 불꽃타입의 기술이 강해진다.,"This Pokémon is immune to fire-type moves.  Once this Pokémon has been hit by a Fire move, its own Fire moves will inflict 1.5× as much damage until it leaves battle.  This ability has no effect while the Pokémon is frozen.  The Fire damage bonus is retained even if the Pokémon is frozen and thawed or the ability is lost or disabled.  Fire moves will ignore this Pokémon's substitute.  This ability takes effect even on non-damaging moves, i.e. will o wisp.",3
19,Shield Dust,りんぷん,인분,Protective dust shields the Pokémon from the additional effects of moves.,인분에 보호받아 기술의 추가 효과를 받지 않게 된다.,"This Pokémon is immune to the extra effects of moves used against it.  An extra effect is a move's chance, listed as an ""effect chance"", to inflict a status ailment, cause a stat change, or make the target flinch in addition to the move's main effect.  For example, thunder shock's paralysis is an extra effect, but thunder wave's is not, nor are knock off's item removal and air cutter's increased critical hit rate.",3
20,Own Tempo,マイペース,마이페이스,"The Pokémon sticks to its own tempo, preventing it from becoming confused or being affected by Intimidate.",마이페이스라서 혼란 상태가 되지 않는다. 위협을 당해도 동요하지 않는다.,"This Pokémon cannot be confused.  If a Pokémon is confused and acquires this ability, its confusion will immediately be healed.",3
21,Suction Cups,きゅうばん,흡반,The Pokémon uses suction cups to stay in one spot. This protects it from moves and items that would force it to switch out.,흡반으로 지면에 달라붙어 포켓몬을 교체시키는 기술이나 도구의 효과를 발휘하지 못하게 한다.,"This Pokémon cannot be forced out of battle by moves such as whirlwind.  dragon tail and circle throw still inflict damage against this Pokémon.  Overworld: If the lead Pokémon has this ability, the success rate while fishing is increased.",3
22,Intimidate,いかく,위협,"When the Pokémon enters a battle, it intimidates opposing Pokémon and makes them cower, lowering their Attack stats.",등장했을 때 위협해서 상대를 위축시켜 상대의 공격을 떨어뜨린다.,"When this Pokémon enters battle, the opponent's Attack is lowered by one stage.  In a double battle, both opponents are affected.  This ability also takes effect when acquired during a battle, but will not take effect again if lost and reobtained without leaving battle.  This ability has no effect on an opponent that has a substitute.  Overworld: If the first Pokémon in the party has this ability, any random encounter with a Pokémon five or more levels lower than it has a 50% chance of being skipped.",3
23,Shadow Tag,かげふみ,그림자밟기,The Pokémon steps on the opposing Pokémon's shadows to prevent them from fleeing or switching out.,상대의 그림자를 밟아 도망치거나 교체할 수 없게 한다.,"While this Pokémon is in battle, opposing Pokémon cannot flee or switch out.  Other Pokémon with this ability are unaffected.  Pokémon with run away can still flee.  Pokémon can still switch out with the use of a move or item.",3
24,Rough Skin,さめはだ,까칠한피부,The Pokémon's rough skin damages attackers that make direct contact with it.,공격을 받았을 때 자신에게 접촉한 상대를 까칠까칠한 피부로 상처를 입힌다.,"Whenever a move makes contact with this Pokémon, the move's user takes 1/8 of its maximum HP in damage.  This ability functions identically to iron barbs.",3
25,Wonder Guard,ふしぎなまもり,불가사의부적,Its mysterious power only lets supereffective moves hit the Pokémon.,효과가 굉장한 기술만 맞는 불가사의한 힘.,"This Pokémon is immune to damaging moves that are not super effective against it.  Moves that inflict fixed damage, such as night shade or seismic toss, are considered super effective if their types are.  Damage not directly dealt by moves, such as damage from weather, a status ailment, or spikes, is not prevented.  This ability cannot be copied with role play or traded away with skill swap, but it can be copied with trace, disabled with gastro acid, or changed with worry seed.  This Pokémon can still use Role Play itself to lose this ability, but not Skill Swap.  If this Pokémon has a substitute, this ability will block moves as usual and any moves not blocked will react to the Substitute as usual.",3
26,Levitate,ふゆう,부유,"By floating in the air, the Pokémon receives full immunity to all Ground-type moves.",땅에서 뜨는 성질 때문에 땅타입의 기술로 공격받지 않는다.,"This Pokémon is immune to ground-type moves, spikes, toxic spikes, and arena trap.  This ability is disabled during gravity or ingrain, or while holding an iron ball.  This ability is not disabled during roost.",3
27,Effect Spore,ほうし,포자,"Contact with the Pokémon may inflict poison, sleep, or paralysis on the attacker.","공격으로 자신에게 접촉한 상대를 독이나 마비, 잠듦 상태로 만들 때가 있다.","Whenever a move makes contact with this Pokémon, the move's user has a 30% chance of being paralyzed, poisoned, or put to sleep, chosen at random.  Nothing is done to compensate if the move's user is immune to one of these ailments; there is simply a lower chance that the move's user will be affected.",3
28,Synchronize,シンクロ,싱크로,"If the Pokémon is burned, paralyzed, or poisoned by another Pokémon, that Pokémon will be inflicted with the same status condition.","자신이 걸린 독이나 마비, 화상을 상대에게 옮긴다.","Whenever this Pokémon is burned, paralyzed, or poisoned, the Pokémon who gave this Pokémon that ailment is also given the ailment.  This ability passes back bad poison when this Pokémon is badly poisoned.  This ability cannot pass on a status ailment that the Pokémon did not directly receive from another Pokémon, such as the poison from toxic spikes or the burn from a flame orb.  Overworld: If the lead Pokémon has this ability, wild Pokémon have a 50% chance of having the lead Pokémon's nature, and a 50% chance of being given a random nature as usual, including the lead Pokémon's nature.  This does not work on Pokémon received outside of battle or roaming legendaries.",3
29,Clear Body,クリアボディ,클리어바디,Prevents other Pokémon's moves or Abilities from lowering the Pokémon's stats.,상대 기술이나 특성으로 능력이 떨어지지 않는다.,"This Pokémon cannot have its stats lowered by other Pokémon.  This ability does not prevent any stat losses other than stat modifiers, such as the Speed cut from paralysis.  This Pokémon can still be passed negative stat modifiers through guard swap, heart swap, or power swap.  This ability functions identically to white smoke in battle.",3
30,Natural Cure,しぜんかいふく,자연회복,The Pokémon's status conditions are cured when it switches out.,지닌 포켓몬으로 돌아오면 상태 이상이 회복된다.,"This Pokémon is cured of any major status ailment when it is switched out for another Pokémon.  If this ability is acquired during battle, the Pokémon is cured upon leaving battle before losing the temporary ability.",3
31,Lightning Rod,ひらいしん,피뢰침,"The Pokémon draws in all Electric-type moves. Instead of taking damage from them, its Sp. Atk stat is boosted.",전기타입의 기술을 자신에게 끌어모아 데미지를 받지 않고 특수공격을 올린다.,"All other Pokémon's single-target electric-type moves are redirected to this Pokémon if it is an eligible target.  Other Pokémon's Electric moves raise this Pokémon's Special Attack one stage, negating any other effect on it, and cannot miss it.  If the move's intended target also has this ability, the move is not redirected.  When multiple Pokémon with this ability are possible targets for redirection, the move is redirected to the one with the highest Speed stat, or, in the case of a tie, to a random tied Pokémon.  follow me takes precedence over this ability.  If the Pokémon is a ground-type and thus immune to Electric moves, its immunity prevents the Special Attack boost.",3
32,Serene Grace,てんのめぐみ,하늘의은총,Raises the likelihood of additional effects occurring when the Pokémon uses its moves.,하늘의 은총 덕분에 기술의 추가 효과가 나오기 쉽다.,"This Pokémon's moves have twice their usual effect chance.  An effect chance is a move's chance to inflict a status ailment, cause a stat change, or make the target flinch in addition to the move's main effect.  For example, flamethrower's chance of burning the target is doubled, but protect's chance of success and air cutter's increased critical hit rate are unaffected.  secret power is unaffected.",3
33,Swift Swim,すいすい,쓱쓱,Boosts the Pokémon's Speed stat in rain.,비가 오는 날씨일 때 스피드가 올라간다.,This Pokémon's Speed is doubled during rain.  This bonus does not count as a stat modifier.,3
34,Chlorophyll,ようりょくそ,엽록소,Boosts the Pokémon's Speed stat in harsh sunlight.,날씨가 맑을 때 스피드가 올라간다.,This Pokémon's Speed is doubled during strong sunlight.  This bonus does not count as a stat modifier.,3
35,Illuminate,はっこう,발광,"By illuminating its surroundings, the Pokémon prevents its accuracy from being lowered.",주변을 밝게 하여 명중률이 떨어지지 않는다.,"Overworld: If the lead Pokémon has this ability, the wild encounter rate is doubled.  This ability has no effect in battle.",3
36,Trace,トレース,트레이스,"When it enters a battle, the Pokémon copies an opposing Pokémon's Ability.",등장했을 때 상대의 특성을 트레이스해서 같은 특성이 된다.,"When this Pokémon enters battle, it copies a random opponent's ability.  This ability cannot copy flower gift, forecast, illusion, imposter, multitype, trace, wonder guard, or zen mode.",3
37,Huge Power,ちからもち,천하장사,Doubles the Pokémon's Attack stat.,물리공격의 위력이 2배가 된다.,This Pokémon's Attack is doubled while in battle.  This bonus does not count as a stat modifier.  This ability functions identically to pure power.,3
38,Poison Point,どくのトゲ,독가시,Contact with the Pokémon may poison the attacker.,자신에게 접촉한 상대를 독 상태로 만들 때가 있다.,"Whenever a move makes contact with this Pokémon, the move's user has a 30% chance of being poisoned.",3
39,Inner Focus,せいしんりょく,정신력,The Pokémon's intense focus prevents it from flinching or being affected by Intimidate.,단련한 정신 덕분에 상대의 공격에 풀죽지 않는다. 위협을 당해도 동요하지 않는다.,This Pokémon cannot flinch.,3
40,Magma Armor,マグマのよろい,마그마의무장,The Pokémon's hot magma coating prevents it from being frozen.,뜨거운 마그마를 몸에 둘러서 얼음 상태가 되지 않는다.,"This Pokémon cannot be frozen.  If a Pokémon is frozen and acquires this ability, it will immediately thaw out; this includes when regaining a lost ability upon leaving battle.  Overworld: If any Pokémon in the party has this ability, each egg in the party has its hatch counter decreased by 2 (rather than 1) each step cycle, making eggs hatch roughly twice as quickly.  This effect does not stack if multiple Pokémon have this ability or flame body.",3
41,Water Veil,みずのベール,수의베일,The Pokémon's water veil prevents it from being burned.,물의 베일을 몸에 둘러서 화상 상태가 되지 않는다.,"This Pokémon cannot be burned.  If a Pokémon is burned and acquires this ability, its burn is healed; this includes when regaining a lost ability upon leaving battle.",3
42,Magnet Pull,じりょく,자력,Prevents Steel-type Pokémon from fleeing by pulling them in with magnetism.,강철타입의 포켓몬을 자력으로 끌어모아 도망칠 수 없게 한다.,"While this Pokémon is in battle, opposing steel-type Pokémon cannot flee or switch out.  Pokémon with run away can still flee.  Pokémon can still switch out with the use of a move or item.  Overworld: If the lead Pokémon has this ability, Steel-type Pokémon have a higher encounter rate.",3
43,Soundproof,ぼうおん,방음,Soundproofing gives the Pokémon full immunity to all sound-based moves.,소리를 차단하여 소리 기술의 영향을 받지 않는다.,"This Pokémon is immune to moves flagged as being sound-based.  heal bell is unaffected.  uproar still prevents this Pokémon from sleeping.  This Pokémon can still receive a Perish Song counter through baton pass, and will retain a Perish Song counter if it acquires this ability after Perish Song is used.  howl, roar of time, sonic boom, and yawn are not flagged as sound-based.",3
44,Rain Dish,あめうけざら,젖은접시,The Pokémon gradually regains HP in rain.,비가 오는 날씨일 때 조금씩 HP를 회복한다.,This Pokémon heals for 1/16 of its maximum HP after each turn during rain.,3
45,Sand Stream,すなおこし,모래날림,The Pokémon summons a sandstorm when it enters a battle.,등장했을 때 날씨를 모래바람으로 만든다.,"The weather changes to a sandstorm when this Pokémon enters battle and does not end unless cancelled by another weather condition.  If multiple Pokémon with this ability, drizzle, drought, or snow warning are sent out at the same time, the abilities will activate in order of Speed, respecting trick room.  Each ability's weather will cancel the previous weather, and only the weather summoned by the slowest of the Pokémon will stay.  Overworld: If the lead Pokémon has this ability, the wild encounter rate is halved in a sandstorm. If the weather is extremely harsh sunlight, heavy rain, or mysterious air current, this ability will not be activated.",3
46,Pressure,プレッシャー,프레셔,"Puts other Pokémon under pressure, causing them to expend more PP to use their moves.",프레셔를 줘서 상대가 쓰는 기술의 PP를 많이 줄인다.,"Moves targetting this Pokémon use one extra PP.  This ability stacks if multiple targets have it.  This ability still affects moves that fail or miss.  This ability does not affect ally moves that target either the entire field or just its side, nor this Pokémon's self-targetted moves; it does, however, affect single-targetted ally moves aimed at this Pokémon, ally moves that target all other Pokémon, and opponents' moves that target the entire field.  If this ability raises a move's PP cost above its remaining PP, it will use all remaining PP.  When this Pokémon enters battle, all participating trainers are notified that it has this ability.  Overworld: If the lead Pokémon has this ability, higher-levelled Pokémon have their encounter rate increased.",3
47,Thick Fat,あついしぼう,두꺼운지방,"The Pokémon is protected by a layer of thick fat, which halves the damage taken from Fire- and Ice-type moves.",두꺼운 지방으로 보호되고 있어 불꽃타입과 얼음타입의 기술의 데미지를 반감시킨다.,This Pokémon takes half as much damage from fire- and ice-type moves.,3
48,Early Bird,はやおき,일찍기상,The Pokémon awakens from sleep twice as fast as other Pokémon.,잠듦 상태가 되어도 2배 빠르게 깨어날 수 있다.,"This Pokémon's remaining sleep turn count falls by 2 rather than 1.  If this Pokémon's sleep counter is at 1, it will fall to 0 and then the Pokémon will wake up.",3
49,Flame Body,ほのおのからだ,불꽃몸,Contact with the Pokémon may burn the attacker.,자신에게 접촉한 상대를 화상 상태로 만들 때가 있다.,"Whenever a move makes contact with this Pokémon, the move's user has a 30% chance of being burned.  Overworld: If any Pokémon in the party has this ability, each egg in the party has its hatch counter decreased by 2 (rather than 1) each step cycle, making eggs hatch roughly twice as quickly.  This effect does not stack if multiple Pokémon have this ability or magma armor.",3
50,Run Away,にげあし,도주,Enables a sure getaway from wild Pokémon.,야생 포켓몬으로부터 반드시 도망칠 수 있다.,"This Pokémon is always successful fleeing from wild battles, even if trapped by a move or ability.",3
51,Keen Eye,するどいめ,날카로운눈,The Pokémon's keen eyes prevent its accuracy from being lowered. It also ignores the target's stages in evasion.,날카로운 눈 덕분에 명중률이 떨어지지 않는다.,"This Pokémon cannot have its accuracy lowered.  This ability does not prevent any accuracy losses other than stat modifiers, such as the accuracy cut from fog; nor does it prevent other Pokémon's evasion from making this Pokémon's moves less accurate.  This Pokémon can still be passed negative accuracy modifiers through heart swap.  Overworld: If the first Pokémon in the party has this ability, any random encounter with a Pokémon five or more levels lower than it has a 50% chance of being skipped.",3
52,Hyper Cutter,かいりきバサミ,괴력집게,"The Pokémon's prized, mighty pincers prevent other Pokémon from lowering its Attack stat.",힘이 자랑인 집게를 가지고 있어 상대가 공격을 떨어뜨리지 못하게 한다.,"This Pokémon's Attack cannot be lowered by other Pokémon.  This ability does not prevent any Attack losses other than stat modifiers, such as the Attack cut from a burn.  This Pokémon can still be passed negative Attack modifiers through heart swap or power swap.",3
